title,authors,year,summary,keywords
color vision,"Gegenfurtner, K. R. & Kiper, D. C.",2003,"este paper revisa los mecanismos neuronales que sustentan la percepción del color en humanos. describe cómo la retina codifica la información cromática mediante tres tipos de conos (s, m, l) sensibles a diferentes longitudes de onda. en el núcleo geniculado lateral (lgn) y la corteza visual, las señales se combinan en canales oponentes (rojo-verde, azul-amarillo, luminancia) que construyen la percepción del color. se enfatiza que la percepción del color es un proceso distribuido, dependiente de la integración con la forma, el movimiento y la luminancia.","color, percepción, retina, lgn, canales oponentes, corteza visual, matices, luminancia, procesamiento visual, integración forma-color"
a direct demonstration of functional specialization in human visual cortex,"Zeki, S.",1991,"este estudio demuestra que la corteza visual humana está organizada en áreas funcionalmente especializadas para procesar diferentes atributos visuales, como color, forma y movimiento. mediante técnicas de neuroimagen, zeki muestra que el área v4 está implicada principalmente en el procesamiento del color, mientras que el área v5 (mt) responde selectivamente al movimiento. estos hallazgos apoyan la idea de que la percepción visual emerge de la integración coordinada de múltiples módulos especializados.","corteza visual, especialización funcional, área v4, área v5, procesamiento del color, procesamiento del movimiento, neuroimagen, percepción visual, módulos especializados"
three cortical stages of colour processing in the human brain,"Zeki, S.",1998,"este paper describe tres etapas corticales en el procesamiento del color en el cerebro humano. la primera ocurre en el área v1, donde las neuronas responden a contrastes cromáticos simples. la segunda etapa, en el área v2, integra señales de diferentes longitudes de onda. finalmente, la tercera etapa, en el área v4, representa la percepción del color estable y consciente, independiente de la iluminación. el trabajo demuestra que la experiencia del color es el resultado de una jerarquía de procesamiento progresivo a través de la corteza visual.","procesamiento del color, corteza visual, área v1, área v2, área v4, percepción del color, jerarquía cortical, integración cromática, experiencia visual"
the architecture of the colour centre in the human visual cortex,"Bartels, A. & Zeki, S.",2000,"este estudio analiza la organización funcional del área v4, considerada el centro del color en la corteza visual humana. utilizando fmri, los autores muestran que v4 no es una región única, sino un conjunto distribuido de subregiones que responden selectivamente a diferentes aspectos del color, como la saturación, el contraste y la constancia cromática. los resultados apoyan la idea de una red cortical distribuida dedicada al procesamiento del color, más que un único módulo.","área v4, centro del color, corteza visual, fmri, procesamiento del color, organización funcional, subregiones, saturación, contraste, constancia cromática"
categorical encoding of color in the brain,"Bird, C. M. et al.",2014,"este estudio investiga cómo el cerebro codifica los colores en categorías perceptuales. usando fmri, los autores encontraron que regiones del córtex occipital y temporal responden de manera diferente a colores que pertenecen a distintas categorías lingüísticas, incluso cuando las diferencias físicas son mínimas. esto sugiere que la codificación del color no solo depende de la percepción sensorial, sino también de factores cognitivos y del lenguaje, mostrando una interacción entre percepción visual y representación conceptual.","codificación del color, categorías perceptuales, fmri, corteza occipital, corteza temporal, percepción sensorial, factores cognitivos, lenguaje, interacción percepción-concepto"
the response to colour in the human visual cortex: an fmri review,"Mullen, K. T.",2019,"esta revisión analiza estudios de fmri sobre cómo diferentes áreas de la corteza visual humana responden a estímulos cromáticos. se confirma que las áreas v1, v2 y v4 muestran respuestas específicas a la información de color, con v4 desempeñando un papel central en la percepción consciente del color. el artículo también destaca la interacción entre color, luminancia y atención, y cómo estas variables modulan la activación cortical. mullen propone un modelo jerárquico donde la percepción del color emerge de una red distribuida que integra información espacial y cromática.","fmri, corteza visual, áreas v1, v2, v4, percepción del color, luminancia, atención, activación cortical, modelo jerárquico, red distribuida"
human v4 activity patterns predict behavioral performance,"Bannert, M. M. & Bartels, A.",2018,"este estudio muestra que la actividad neuronal en el área v4 del cerebro humano predice el rendimiento en tareas perceptivas relacionadas con el color. utilizando fmri y análisis multivoxel, los autores demostraron que los patrones de activación en v4 contienen información suficiente para distinguir colores percibidos, incluso cuando las diferencias físicas en los estímulos son pequeñas. esto sugiere que v4 no solo codifica el color de manera pasiva, sino que también refleja la experiencia perceptual y el desempeño conductual asociado al color.","área v4, rendimiento perceptivo, fmri, análisis multivoxel, codificación del color, experiencia perceptual, desempeño conductual, activación neuronal"
exploring the effect of red and blue on cognitive task performance,"Xia, T. et al.",2016,"este estudio analiza cómo los colores rojo y azul influyen en el rendimiento cognitivo. los resultados muestran que el color rojo tiende a mejorar la atención al detalle y el rendimiento en tareas de precisión, mientras que el azul favorece la creatividad y el pensamiento abstracto. a nivel neurofisiológico, se observan diferencias en la activación cortical relacionadas con la modulación emocional y la carga cognitiva. estos hallazgos apoyan la idea de que los colores pueden modular estados mentales y funciones ejecutivas de forma sistemática.","colores, rendimiento cognitivo, atención, creatividad, activación cortical, modulación emocional, carga cognitiva, funciones ejecutivas"
the processing of color preference in the brain,"Racey, C. et al.",2019,"este estudio investiga cómo el cerebro procesa las preferencias de color y qué áreas neuronales están implicadas. usando fmri, los autores identificaron una mayor activación en regiones del córtex visual (v4) y áreas asociadas al sistema de recompensa, como el estriado ventral, cuando los participantes observaban colores que declaraban como preferidos. los resultados sugieren que la preferencia por el color integra tanto la percepción visual como procesos afectivos, conectando la estética visual con la motivación y el placer.","preferencia de color, fmri, corteza visual, área v4, sistema de recompensa, estriado ventral, percepción visual, procesos afectivos, estética visual, motivación"
toward a unified theory of visual area v4,"Roe, A. W. et al.",2012,"este trabajo propone una teoría unificada sobre la función del área visual v4, integrando hallazgos sobre color, forma, y atención. los autores revisan evidencias neurofisiológicas y de neuroimagen que indican que v4 no solo está especializada en el procesamiento del color, sino que también participa en la codificación de la forma, la textura y la organización espacial de los estímulos visuales. se plantea que v4 actúa como un centro integrador que combina información cromática y geométrica, facilitando la percepción coherente de objetos.","área v4, teoría unificada, procesamiento del color, codificación de la forma, textura, organización espacial, integración de información, percepción de objetos"
representation of perceived object shape by the human lateral occipital complex,"Kourtzi, Z. & Kanwisher, N.",2001,"este estudio demuestra que el complejo occipital lateral (loc) del cerebro humano representa la forma percibida de los objetos, más que sus características físicas simples. utilizando fmri, los autores observaron que la actividad en el loc se mantiene estable incluso cuando cambian aspectos visuales como la textura, el color o la iluminación, siempre que la forma percibida del objeto sea la misma. esto sugiere que el loc desempeña un papel crucial en la abstracción y reconocimiento de formas, independiente de la información sensorial superficial.","complejo occipital lateral, loc, forma percibida, fmri, reconocimiento de objetos, abstracción de formas, independencia sensorial, percepción visual"
the lateral occipital complex and its role in object recognition,"Grill-Spector, K., Kourtzi, Z. & Kanwisher, N.",2001,"este estudio profundiza en el papel del complejo occipital lateral (loc) en el reconocimiento de objetos. a través de fmri, se observó que el loc responde fuertemente a la percepción de objetos completos en comparación con sus partes fragmentadas o estímulos sin forma coherente. además, su activación se asocia con la identificación consciente de los objetos más que con la simple detección visual. estos resultados consolidan al loc como una región clave en la jerarquía visual para el reconocimiento de formas y objetos.","complejo occipital lateral, loc, reconocimiento de objetos, fmri, percepción visual, identificación consciente, jerarquía visual, formas coherentes"
shape perception reduces activity in human primary visual cortex,"Murray, S. O. et al.",2002,"este estudio revela que la percepción coherente de la forma reduce la actividad en la corteza visual primaria (v1). utilizando fmri, los autores demostraron que cuando los observadores perciben una figura organizada a partir de estímulos visuales ambiguos, la actividad en v1 disminuye, mientras que aumenta en regiones superiores como el complejo occipital lateral (loc). estos resultados sugieren que la percepción de la forma implica un procesamiento jerárquico con retroalimentación desde áreas superiores, lo que optimiza la eficiencia del procesamiento visual.","percepción de la forma, corteza visual primaria, v1, fmri, complejo occipital lateral, loc, procesamiento jerárquico, retroalimentación, eficiencia visual"
the large-scale organization of shape processing in visual cortex,"Freud, E. et al.",2017,"este estudio explora la organización a gran escala del procesamiento de formas en la corteza visual humana. mediante análisis de fmri y conectividad funcional, los autores muestran que el procesamiento de la forma no se limita a una única región (como el loc), sino que involucra una red distribuida que incluye áreas ventrales y dorsales. se identifican gradientes funcionales que representan distintos niveles de abstracción de la forma, desde características locales hasta representaciones globales de objetos. esto sugiere una arquitectura visual altamente integrada y jerárquica.","procesamiento de formas, corteza visual, fmri, conectividad funcional, red distribuida, áreas ventrales, áreas dorsales, gradientes funcionales, abstracción de la forma, arquitectura visual"
imagining material versus geometric properties of objects,"Newman, S. D. et al.",2005,"este estudio examina cómo el cerebro diferencia entre la imaginación de las propiedades materiales (como textura o brillo) y las propiedades geométricas (como forma o contorno) de los objetos. utilizando fmri, los autores encontraron que imaginar propiedades materiales activa regiones relacionadas con la percepción táctil y visual ventral, mientras que las propiedades geométricas implican áreas más dorsales asociadas al análisis espacial. esto evidencia una separación funcional en la representación mental de los objetos según el tipo de atributo percibido o imaginado.","imaginación de objetos, propiedades materiales, propiedades geométricas, fmri, corteza visual ventral, corteza visual dorsal, representación mental, percepción táctil, análisis espacial"
steady-state visually evoked potentials: paradigms and perspectives,"Vialatte, F.-B., Maurice, M., Dauwels, J. & Cichocki, A.",2010,"este artículo ofrece una revisión exhaustiva de los potenciales visuales evocados en estado estable (ssveps), una respuesta neuronal periódica generada por estímulos visuales rítmicos. los autores discuten los mecanismos neurofisiológicos subyacentes, las frecuencias óptimas de estimulación y las aplicaciones en neurociencia cognitiva y interfaces cerebro-computadora. se destaca que la frecuencia e intensidad del estímulo visual pueden modular la amplitud y fase de la respuesta cortical, proporcionando información sobre la sincronización neuronal y la plasticidad visual.","potenciales visuales evocados en estado estable, ssveps, neurofisiología, estimulación rítmica, neurociencia cognitiva, interfaces cerebro-computadora, sincronización neuronal, plasticidad visual"
the steady-state visual evoked potential in vision research,"Norcia, A. M. et al.",2015,"esta revisión analiza el uso de los potenciales visuales evocados en estado estable (ssveps) en la investigación de la visión. los autores discuten cómo diferentes frecuencias de estímulo visual producen respuestas corticales específicas y cómo estas pueden ser utilizadas para estudiar la percepción, la atención y la integración sensorial. también se revisan aplicaciones prácticas en estudios de cognición, desarrollo y patologías visuales, resaltando la robustez y precisión de los ssveps para mapear la actividad neuronal relacionada con estímulos rítmicos.","potenciales visuales evocados en estado estable, ssveps, investigación de la visión, percepción, atención, integración sensorial, cognición, desarrollo visual, patologías visuales, actividad neuronal"
characteristics of steady-state and transient responses evoked by modulated light,"Regan, D.",1966,"este estudio clásico analiza las respuestas visuales del cerebro ante estímulos luminosos modulados, diferenciando entre respuestas transitorias y en estado estable (steady-state). regan muestra que las respuestas ssvep son altamente dependientes de la frecuencia del estímulo y que la amplitud y fase de la señal eeg varían según la modulación luminosa. estos hallazgos proporcionan la base para comprender cómo el sistema visual codifica información temporal y cómo se pueden optimizar los estímulos visuales para generar respuestas corticales predecibles.","potenciales visuales evocados, respuestas transitorias, respuestas en estado estable, ssvep, modulación luminosa, frecuencia del estímulo, codificación temporal, sistema visual, eeg"
human eeg responses to 1100 hz flicker: resonance phenomena in visual cortex,"Herrmann, C. S.",2001,"este estudio examina cómo el cerebro humano responde a estímulos visuales intermitentes (flicker) en un rango de 1 a 100 hz, utilizando eeg. se identifican fenómenos de resonancia en la corteza visual, donde ciertas frecuencias generan respuestas amplificadas, indicando que el cerebro tiene bandas de frecuencia óptimas para el procesamiento visual. estos hallazgos son fundamentales para comprender la sincronización neuronal, el procesamiento temporal de estímulos y el diseño de estímulos visuales para investigación y aplicaciones en neurotecnología.","potenciales visuales evocados, eeg, flicker, resonancia cortical, corteza visual, sincronización neuronal, procesamiento temporal, neurotecnología"
presence of strong harmonics during visual entrainment,"Heinrichs-Graham, E. et al.",2012,"este estudio investiga la generación de armónicos fuertes en la corteza visual durante el entrainment visual rítmico. utilizando meg, los autores muestran que la estimulación visual periódica no solo produce respuestas fundamentales sino también armónicos múltiples, reflejando la compleja dinámica neuronal y la interacción entre diferentes redes corticales. los hallazgos ayudan a entender cómo la frecuencia y el patrón de los estímulos modulan la sincronización neuronal y la percepción visual.","entrainment visual, armónicos, meg, corteza visual, dinámica neuronal, redes corticales, sincronización neuronal, percepción visual"
optimal gamma-band entrainment of visual cortex,"Petro, N. M. et al.",2024,"este estudio explora cómo la corteza visual humana responde al entrainment en la banda gamma (~30100 hz) usando técnicas de neuroimagen. los autores muestran que existe un rango óptimo de frecuencias gamma que maximiza la sincronización neuronal y mejora la codificación de estímulos visuales. además, se observa que esta sincronización facilita la integración de color, forma y movimiento, sugiriendo aplicaciones para el diseño de estímulos visuales que optimicen la percepción y la atención.","entrainment visual, banda gamma, corteza visual, sincronización neuronal, neuroimagen, codificación de estímulos, integración sensorial, percepción visual, atención"
rod-driven frequency entrainment and resonance,"Salchow, C. et al.",2016,"este estudio analiza cómo los bastones (fotorreceptores sensibles a baja luminosidad) contribuyen al entrainment y resonancia cortical ante estímulos visuales periódicos. usando eeg, los autores muestran que la frecuencia de estimulación modula la respuesta neuronal en función de la vía rod-dominante, destacando diferencias entre percepción en condiciones de luz baja y alta. los hallazgos ofrecen información clave para diseñar estímulos visuales efectivos en entornos con iluminación variable y para entender la contribución de la vía rod a la sincronización cortical.","entrainment visual, bastones, resonancia cortical, eeg, vía rod-dominante, percepción visual, iluminación variable, sincronización cortical"
attenuated fast ssveps during sleep,"Sharon, O. et al.",2018,"este estudio investiga cómo los potenciales visuales evocados en estado estable (ssveps) se ven afectados durante el sueño. usando eeg, los autores muestran que las respuestas rápidas a estímulos visuales periódicos se atenúan significativamente en comparación con la vigilia, indicando una disminución en la sincronización neuronal y la sensibilidad cortical durante diferentes fases del sueño. estos resultados ayudan a comprender cómo el procesamiento visual y la atención cortical cambian en estados de conciencia alterados.","ssveps, sueño, eeg, sincronización neuronal, sensibilidad cortical, procesamiento visual, atención cortical, estados de conciencia alterados"
"visual stimulation under 4 hz, not 10 hz, generates distinct responses","Retter, T. L. et al.",2025,"este estudio analiza cómo diferentes frecuencias de estimulación visual afectan la respuesta cortical medida por eeg. los autores muestran que estímulos a 4 hz generan respuestas distintivas en comparación con 10 hz, destacando que la frecuencia baja produce mayor sincronización en ciertas áreas visuales. estos hallazgos sugieren que la elección de la frecuencia de estimulación es crucial para manipular la actividad cortical y diseñar estímulos visuales optimizados para experimentos de percepción y neuroestética.","estimulación visual, frecuencias bajas, eeg, sincronización cortical, percepción visual, neuroestética, diseño de estímulos, respuesta cortical"
critical flicker fusion frequency: a narrative review,"Mankowska, N. D. et al.",2021,"esta revisión narrativa analiza la frecuencia crítica de fusión de parpadeo (cff), que es la velocidad a la cual un estímulo intermitente se percibe como constante. los autores discuten cómo factores como la luminancia, color, edad y fatiga afectan la cff, así como sus implicaciones en percepción visual, diseño de pantallas y estudios de ssvep. el trabajo también sintetiza hallazgos sobre la variabilidad individual y los mecanismos neuronales que determinan la percepción temporal de estímulos visuales.","frecuencia crítica de fusión de parpadeo, cff, percepción visual, luminancia, color, edad, fatiga, diseño de pantallas, ssvep, mecanismos neuronales"
ssveps reveal crossmodal pitchvision associations,"Sciortino, P. et al.",2023,"este estudio explora asociaciones crossmodales entre sonido (pitch) y percepción visual usando potenciales visuales evocados en estado estable (ssveps). los autores muestran que ciertas frecuencias visuales se sincronizan con tonos específicos, revelando una integración multisensorial en la corteza visual y auditiva. los hallazgos sugieren que el cerebro integra información de diferentes modalidades sensoriales para crear experiencias perceptuales coherentes, con implicaciones para neuroestética y diseño de estímulos multisensoriales.","ssveps, asociaciones crossmodales, percepción visual, percepción auditiva, integración multisensorial, corteza visual, corteza auditiva, experiencias perceptuales, neuroestética, diseño multisensorial"
ssveps combined with behavioural tasks in perception research,"Wittenhagen, L. et al.",2019,"este estudio combina potenciales visuales evocados en estado estable (ssveps) con tareas conductuales para investigar la percepción visual. los autores muestran que los ssveps reflejan no solo la respuesta cortical a estímulos rítmicos, sino también la atención y el rendimiento en tareas cognitivas. estos hallazgos subrayan la utilidad de los ssveps como herramienta para vincular la actividad neuronal con el comportamiento perceptual y para diseñar experimentos que exploren la interacción entre estímulo visual y respuesta conductual.","ssveps, tareas conductuales, percepción visual, atención, rendimiento cognitivo, actividad neuronal, comportamiento perceptual, diseño experimental"
review of computational neuroaesthetics,"Li, R. et al.",2020,"esta revisión analiza el campo emergente de la neuroestética computacional, que combina neurociencia, psicología y modelado computacional para entender cómo el cerebro responde a estímulos estéticamente significativos. se discuten métodos para cuantificar respuestas neuronales a propiedades visuales como color, forma, simetría y complejidad, así como técnicas de machine learning para predecir preferencias estéticas. el trabajo destaca la importancia de integrar datos empíricos con modelos computacionales para explorar la percepción estética de manera sistemática.","neuroestética computacional, neurociencia, psicología, modelado computacional, respuestas neuronales, propiedades visuales, machine learning, preferencias estéticas, percepción estética, integración de datos"
a narrative scoping review of neuroaesthetics and visual perception,"Atiyeh, B. et al.",2025,"esta revisión narrativa aborda la neuroestética y la percepción visual, explorando cómo diferentes propiedades visuales (color, forma, luz) afectan la experiencia estética y la actividad cerebral. se destacan estudios de neuroimagen que muestran la implicación de la corteza visual, áreas asociadas a recompensa y regiones frontales en la apreciación estética. el artículo también discute enfoques metodológicos y aplicaciones en diseño visual, arte y entornos interactivos.","neuroestética, percepción visual, propiedades visuales, experiencia estética, actividad cerebral, neuroimagen, corteza visual, áreas de recompensa, diseño visual, arte"
shaping and reshaping the aesthetic brain: emerging perspectives,"Kirsch, L. P. et al.",2016,"este artículo revisa cómo la experiencia estética modifica la actividad cerebral y la percepción visual. los autores discuten cómo estímulos visuales, musicales y artísticos activan redes que incluyen la corteza visual, áreas de recompensa y regiones frontales. además, exploran cómo la exposición repetida y la experiencia previa pueden reconfigurar la percepción estética y la respuesta neuronal, proporcionando evidencia sobre la plasticidad del cerebro en la apreciación artística.","experiencia estética, actividad cerebral, percepción visual, corteza visual, áreas de recompensa, plasticidad cerebral, apreciación artística, redes neuronales, estímulos visuales, reconfiguración perceptual"
neuroelectrical brain imaging on perception and appreciation of pictures,"Maglione, A. G. et al.",2017,"este estudio utiliza técnicas de neuroimagen eléctrica (eeg) para investigar cómo el cerebro procesa y aprecia imágenes visuales. los autores muestran que la percepción de imágenes estéticamente agradables activa tanto la corteza visual como regiones asociadas a la recompensa, destacando la interacción entre procesamiento sensorial y evaluación emocional. se enfatiza la relación entre características visuales de las imágenes (color, forma, composición) y la respuesta neural, ofreciendo información relevante para neuroestética y diseño visual.","neuroimagen eléctrica, eeg, percepción visual, apreciación estética, corteza visual, áreas de recompensa, procesamiento sensorial, evaluación emocional, características visuales, diseño visual"
decoding color and luminance from responses in human visual cortex,"Bannert, M. M. & Bartels, A.",2013,"este estudio investiga cómo la corteza visual humana codifica información de color y luminancia usando fmri y análisis multivoxel. los autores muestran que los patrones de activación en áreas visuales, especialmente v1 y v4, permiten decodificar con precisión el color percibido y los niveles de luminancia. los hallazgos destacan que la percepción visual no depende únicamente de estímulos físicos, sino de representaciones neuronales distribuidas que integran información cromática y de brillo.","corteza visual, codificación del color, luminancia, fmri, análisis multivoxel, áreas visuales, percepción visual, representaciones neuronales, integración cromática, brillo"
