title,authors,year,summary,keywords
"color, motion, and attention in the human visual cortex","Bartels, A. et al.",2008,"este estudio explora cómo el cerebro humano procesa simultáneamente color, movimiento y atención en la corteza visual. usando fmri, los autores muestran que diferentes áreas visuales (como v1, v2, v4 y mt) responden selectivamente a estos atributos, mientras que la atención modula la intensidad y precisión de la activación. los resultados sugieren que la percepción visual es el producto de interacciones dinámicas entre procesamiento de atributos específicos y mecanismos de atención, lo que permite una representación integrada de los estímulos.","corteza visual, procesamiento del color, procesamiento del movimiento, atención visual, fmri, áreas visuales, interacciones dinámicas, percepción visual, representación integrada, mecanismos de atención"
the contribution of area v4 to human color vision,"McKeefry, D. J. & Zeki, S.",1997,"este estudio analiza el papel del área v4 en la percepción del color en humanos. utilizando fmri y estudios de lesionados, los autores muestran que v4 es crucial para la discriminación de colores y la constancia cromática. la activación en v4 permite percibir colores de manera estable a pesar de cambios en la iluminación, lo que indica que esta región integra información cromática y contextos visuales para generar una experiencia perceptual coherente.","área v4, percepción del color, fmri, discriminación de colores, constancia cromática, integración cromática, experiencia perceptual, contexto visual"
distributed neural systems for shape perception,"Kourtzi, Z. et al.",2003,"este estudio investiga cómo el cerebro percibe formas utilizando una red neural distribuida que incluye áreas ventrales y dorsales de la corteza visual. mediante fmri, los autores muestran que diferentes regiones codifican distintos niveles de información de forma, desde características locales hasta representaciones globales de objetos. la integración de estas señales permite un reconocimiento de formas eficiente y robusto frente a variaciones de tamaño, orientación y textura, destacando un procesamiento jerárquico y colaborativo en la percepción visual.","percepción de formas, red neural distribuida, corteza visual ventral, corteza visual dorsal, fmri, codificación de formas, reconocimiento de objetos, procesamiento jerárquico, integración de señales"
single-trial eeg analysis reveals burst structure during flicker stimulation,"Oppermann, H. et al.",2024,"este estudio utiliza análisis de eeg en ensayos individuales para examinar la estructura de ráfagas neuronales durante la estimulación visual intermitente (flicker). los autores muestran que la respuesta cortical no es continua, sino que se organiza en patrones de ráfagas sincronizadas que varían según la frecuencia del estímulo. estos hallazgos aportan información sobre la dinámica temporal de la corteza visual y la forma en que los estímulos rítmicos modulan la actividad neuronal en ensayos individuales.","eeg, análisis de ensayos individuales, ráfagas neuronales, estimulación visual intermitente, flicker, dinámica temporal, corteza visual, modulación neuronal, patrones sincronizados"
stimulus design affects harmonic content of ssvep responses,"Solf, B. et al.",2020,"este estudio investiga cómo el diseño de los estímulos visuales influye en el contenido armónico de las respuestas ssvep. los autores muestran que variaciones en frecuencia, forma, contraste y color del estímulo generan diferentes patrones de armónicos en la corteza visual, indicando que la respuesta neuronal es sensible a las propiedades del estímulo. estos hallazgos son relevantes para optimizar paradigmas de estimulación visual y comprender cómo la estructura de los estímulos modula la sincronización neuronal.","diseño de estímulos, contenido armónico, ssvep, corteza visual, frecuencia del estímulo, forma del estímulo, contraste, color, sincronización neuronal"
critical perspectives on gamma-band visual entrainment,"Duecker, K. et al.",2021,"este artículo revisa críticamente los estudios sobre el entrainment visual en la banda gamma (~30100 hz). los autores discuten las metodologías, inconsistencias y limitaciones en la interpretación de resultados, destacando cómo factores como la frecuencia, intensidad del estímulo y características individuales afectan la sincronización neuronal. se propone un enfoque más riguroso para futuras investigaciones, considerando tanto la dinámica cortical como la percepción visual y la aplicabilidad en neurotecnología.","entrainment visual, banda gamma, sincronización neuronal, metodología, dinámica cortical, percepción visual, neurotecnología, limitaciones de estudio, frecuencia del estímulo, intensidad del estímulo"
color preference modulates activity in visual cortex,"Racey, C. P. et al.",2019,"este estudio investiga cómo las preferencias de color de los individuos influyen en la actividad de la corteza visual. usando fmri, los autores muestran que los colores preferidos generan mayor activación en áreas visuales como v4, y se observa también implicación de regiones relacionadas con recompensa. estos hallazgos sugieren que la percepción estética del color está modulada por factores subjetivos y emociones, integrando procesamiento visual y afectivo.","preferencia de color, corteza visual, fmri, área v4, procesamiento visual, emociones, percepción estética, integración afectiva, activación cortical"
a functional and perceptual signature of the human visual cortex,"Freeman, J. et al.",2013,"este estudio analiza las características funcionales y perceptuales de la corteza visual humana utilizando técnicas de fmri y análisis multivoxel. los autores muestran que distintas áreas visuales codifican atributos específicos como color, forma y textura, y que estos patrones de activación están estrechamente relacionados con la percepción consciente de los estímulos. los resultados destacan la existencia de una firma funcional que refleja cómo la corteza visual organiza y representa la información sensorial para generar experiencias perceptuales coherentes.","corteza visual, fmri, análisis multivoxel, codificación de atributos, percepción consciente, representación sensorial, experiencia perceptual, organización cortical"
the role of shape and color in visual illusion and grouping,"Pinna, B. & Deiana, K.",2018,"este estudio analiza cómo la forma y el color contribuyen a las ilusiones visuales y al agrupamiento perceptual. los autores muestran que ciertos patrones de color y configuración de formas pueden inducir percepciones engañosas, afectando la segmentación y organización de objetos en la visión. estos hallazgos destacan la importancia de la interacción entre atributos visuales en la percepción y ofrecen información útil para diseño gráfico, neuroestética y comprensión de los mecanismos de agrupamiento visual.","forma, color, ilusiones visuales, agrupamiento perceptual, segmentación de objetos, percepción visual, interacción de atributos, diseño gráfico, neuroestética, mecanismos de agrupamiento"
the effects of temporal frequency on motion and shape perception,"Snowden, R. J. et al.",2006,"este estudio investiga cómo la frecuencia temporal de los estímulos visuales afecta la percepción del movimiento y la forma. los autores muestran que frecuencias más altas facilitan la detección de movimiento, mientras que frecuencias más bajas mejoran la percepción de forma. estos hallazgos sugieren que el cerebro ajusta el procesamiento visual según la dinámica temporal del estímulo, implicando mecanismos diferenciados para análisis de forma y movimiento.","frecuencia temporal, percepción del movimiento, percepción de la forma, procesamiento visual, estímulos visuales, mecanismos diferenciados, análisis visual, dinámica temporal"
specificity of flicker adaptation,"Tyler, C. W.",1981,"este estudio examina la adaptación neuronal específica al parpadeo (flicker) visual. los resultados muestran que la exposición repetida a estímulos intermitentes reduce la respuesta cortical, pero de manera selectiva según la frecuencia y características del flicker. esto indica que la corteza visual adapta su sensibilidad a estímulos rítmicos específicos, lo que tiene implicaciones para comprender mecanismos de adaptación, percepción temporal y diseño de estímulos visuales en investigación neurofisiológica.","adaptación al parpadeo, flicker, respuesta cortical, corteza visual, sensibilidad neuronal, percepción temporal, mecanismos de adaptación, estímulos rítmicos, investigación neurofisiológica"
temporal impulse response functions for luminance and color,"Burr, D. & Morrone, M. C.",1996,"este estudio analiza cómo la corteza visual responde a cambios temporales en luminancia y color mediante funciones de respuesta al impulso temporal. los autores muestran que la percepción de luminancia y color sigue diferentes perfiles temporales, indicando que existen mecanismos separados para procesar información de brillo y cromática. estos hallazgos proporcionan información clave sobre el procesamiento temporal de estímulos visuales y la codificación neuronal de atributos visuales esenciales.","respuesta al impulso temporal, luminancia, color, corteza visual, procesamiento temporal, mecanismos separados, percepción visual, codificación neuronal, atributos visuales"
functional architecture for disparity and shape in macaque v4,"Verhoef, B. E. et al.",2012,"este estudio investiga cómo el área v4 de macacos procesa información de disparidad y forma. utilizando registros neuronales, los autores muestran que v4 contiene mapas funcionales especializados que codifican profundidad (disparidad) y características de forma de manera integrada. estos hallazgos sugieren que v4 combina información espacial y de forma para apoyar la percepción tridimensional y la representación de objetos complejos, proporcionando un modelo de arquitectura visual jerárquica y distribuida.","área v4, disparidad, forma, macacos, registros neuronales, mapas funcionales, percepción tridimensional, representación de objetos, arquitectura visual, procesamiento integrado"
"parallel, multi-stage processing of colors and shapes","Lafer-Sousa, R. & Conway, B. R.",2013,"este estudio analiza cómo el cerebro procesa colores y formas en paralelo y en múltiples etapas. usando fmri, los autores muestran que diferentes áreas de la corteza visual ventral procesan simultáneamente atributos cromáticos y geométricos, con integración posterior en niveles jerárquicos superiores. esto sugiere un modelo de procesamiento visual distribuido y especializado, donde la percepción de objetos depende de la combinación de rutas paralelas que manejan color y forma de manera coordinada.","procesamiento paralelo, colores, formas, corteza visual ventral, fmri, integración jerárquica, percepción de objetos, rutas paralelas, procesamiento visual distribuido"
the processing of color and form: an overview,"Wilkinson, F. & Halligan, P.",2004,"esta revisión ofrece una visión general de cómo el cerebro procesa color y forma. los autores discuten hallazgos de neuroimagen, estudios de pacientes y experimentos de percepción, mostrando que color y forma son procesados en rutas parcialmente separadas dentro de la corteza visual, pero que se integran en etapas superiores para la percepción coherente de objetos. se destacan aspectos funcionales de áreas como v1, v2 y v4, y cómo la interacción entre rutas contribuye a la percepción visual y la atención.","procesamiento del color, procesamiento de la forma, corteza visual, neuroimagen, percepción visual, integración de rutas, áreas visuales, atención visual"
from simple cells to perception of shape and color,"Spillmann, L.",2014,"este estudio revisa cómo la información visual se transforma desde células simples en la corteza primaria hasta la percepción compleja de forma y color. se discuten mecanismos de integración neuronal que permiten combinar información de contornos, orientación y cromaticidad, así como la interacción entre vías ventral y dorsal. los hallazgos proporcionan un marco para entender cómo el cerebro construye representaciones perceptuales ricas a partir de señales sensoriales básicas.","células simples, percepción de la forma, percepción del color, corteza primaria, integración neuronal, vías ventral y dorsal, representaciones perceptuales, señales sensoriales"
cortical mechanisms of color vision,"Gegenfurtner, K. R.",2003,"este artículo revisa los mecanismos corticales responsables de la percepción del color. se analiza la función de áreas visuales como v1, v2 y v4 en la codificación de información cromática, la constancia de color y la discriminación de tonalidades. también se discuten modelos teóricos sobre cómo la corteza integra señales de diferentes tipos de conos y cómo la interacción entre rutas paralelas permite la percepción estable y precisa del color.","mecanismos corticales, percepción del color, corteza visual, áreas v1, v2, v4, codificación cromática, constancia de color, discriminación de tonalidades, integración de señales, rutas paralelas"
spatial frequency and flicker interactions in steady-state responses,"Norcia, A. M. & Tyler, C. W.",1985,"este estudio analiza cómo la frecuencia espacial y el parpadeo (flicker) interactúan para generar respuestas visuales en estado estable (ssveps). los autores muestran que la amplitud y fase de las respuestas dependen de la combinación de frecuencia espacial y temporal del estímulo, indicando que la corteza visual procesa de manera integrada estas propiedades. los hallazgos son fundamentales para comprender la codificación neuronal de estímulos complejos y optimizar paradigmas experimentales en neurofisiología visual.","frecuencia espacial, parpadeo, flicker, ssveps, corteza visual, codificación neuronal, estímulos complejos, neurofisiología visual, integración de propiedades, paradigmas experimentales"
impact of color psychology on students perception in learning spaces,"Naz, F.",2024,"este estudio examina cómo los colores de los espacios de aprendizaje afectan la percepción, el estado de ánimo y el rendimiento académico de los estudiantes. se demuestra que los tonos cálidos aumentan la energía y la participación, mientras que los tonos fríos fomentan la concentración y la calma.","color psychology, learning spaces, mood, academic performance, environmental design"
the influence of color on memory performance: a review,"Kühn, S. & Gallinat, J.",2012,"esta revisión analiza cómo diferentes colores afectan el rendimiento de la memoria. los autores encuentran que ciertos colores, como el rojo, pueden mejorar la memoria a corto plazo, mientras que otros, como el azul, favorecen la memoria a largo plazo. estos efectos se atribuyen a la activación emocional y la atención modulada por el color.","color influence, memory performance, short-term memory, long-term memory, emotional activation, attention modulation, red"
effects of coloremotion association on facial expression judgments,"Takei, A. & Imaizumi, S.",2022,"este artículo investiga cómo las asociaciones entre color y emoción influyen en la interpretación de expresiones faciales. los resultados muestran que ciertos colores (como el rojo o el azul) modifican la percepción emocional, amplificando o atenuando la respuesta afectiva del observador.","color-emotion association, facial expression, emotional perception, cognitive bias, visual psychology"
human color perception: the impact of color perception on fine-grained emotion prediction in movie and television videos,"Wang, S. et al.",2024,"este estudio explora cómo la percepción del color en contenido audiovisual influye en la predicción automática de emociones. utiliza modelos computacionales para demostrar que ciertos matices cromáticos se asocian con emociones específicas, mejorando la precisión de los sistemas de reconocimiento emocional.","color perception, emotion prediction, computational aesthetics, affective computing, visual media"
color and psychological functioning: a review of theoretical and empirical work,"Elliot, A. J. & Maier, M. A.",2014,"esta revisión examina la relación entre el color y el funcionamiento psicológico, destacando cómo diferentes colores pueden influir en el estado de ánimo, la cognición y el comportamiento. los autores discuten teorías y estudios empíricos que muestran efectos específicos de colores como el rojo, azul y verde en diversas tareas cognitivas y emocionales.","color psychology, mood, cognition, behavior, theoretical review, empirical studies, red color effects, blue color effects, green color effects"
analysis of the effect of different types of colors on human behavior and emotion,"Lyu, J.",2022,"this paper reviews how different color categories influence human emotion and behavior. it summarizes psychological and physiological evidence linking specific hues with mood, arousal, and decision-making processes.","color psychology, behavior, emotion, hue, decision-making"
"colours of emotion, trust, and exclusivity: a cross-cultural study",—,2024,"this cross-cultural study investigates how specific colors are associated with emotional responses, trust levels, and perceptions of exclusivity across different populations. it highlights cultural variations in color-emotion mapping and their impact on consumer behavior and interpersonal perception.","color-emotion association, trust, exclusivity, cross-cultural psychology, behavior"
